{"contract":1,"not_measured":{"src":"coverage.json#sections[state in not_measured, failed]","unit":"count","value":1},"revision":2,"schema_version":1,"sections":[{"count":{"src":"meta.json#languages","unit":"count","value":1},"detail":"Measured in this check.","parts":[],"reason":"written","section":"meta","state":"measured","step":null,"tool":null},{"count":{"src":"head.json","unit":"count","value":null},"detail":"Measured in this check.","parts":[],"reason":"written","section":"head","state":"measured","step":null,"tool":null},{"count":{"src":"health.json#domains","unit":"count","value":6},"detail":"Measured in this check.","parts":[],"reason":"written","section":"health","state":"measured","step":null,"tool":null},{"count":{"src":"cards.json#cards","unit":"count","value":3},"detail":"Measured in this check.","parts":[],"reason":"written","section":"cards","state":"measured","step":null,"tool":null},{"count":{"src":"evidence.json#facts","unit":"count","value":3},"detail":"Measured in this check.","parts":[],"reason":"written","section":"evidence","state":"measured","step":null,"tool":null},{"count":{"src":"story.json#gap","unit":"count","value":1},"detail":"Measured in this check.","parts":[],"reason":"written","section":"story","state":"measured","step":null,"tool":null},{"count":{"src":"docs.json#docs","unit":"count","value":14},"detail":"Measured in this check.","parts":[],"reason":"written","section":"docs","state":"measured","step":null,"tool":null},{"count":{"src":"plans.json#plans","unit":"count","value":1},"detail":"Measured in this check.","parts":[],"reason":"written","section":"plans","state":"measured","step":null,"tool":null},{"count":{"src":"decisions.json#decisions","unit":"count","value":1},"detail":"Measured in this check.","parts":[],"reason":"written","section":"decisions","state":"measured","step":null,"tool":null},{"count":{"src":"media.json#images","unit":"count","value":2},"detail":"Measured in this check.","parts":[],"reason":"written","section":"media","state":"measured","step":null,"tool":null},{"count":{"src":"functions.json#functions","unit":"count","value":5},"detail":"Measured in this check.","parts":[{"detail":"Python: 5 functions with their calls","id":"Python","state":"measured"}],"reason":"written","section":"functions","state":"measured","step":null,"tool":null},{"count":{"src":"screens.json#screens","unit":"count","value":0},"detail":"Measured; nothing was found.","parts":[],"reason":"nothing_found","section":"screens","state":"empty","step":null,"tool":null},{"count":{"src":"gaps.json#gaps","unit":"count","value":2},"detail":"Measured in this check.","parts":[],"reason":"written","section":"gaps","state":"measured","step":null,"tool":null},{"count":{"src":"operations.json#operations","unit":"count","value":1},"detail":"Measured in this check.","parts":[],"reason":"written","section":"operations","state":"measured","step":null,"tool":null},{"count":{"src":"history.json#scans","unit":"count","value":1},"detail":"Measured in this check.","parts":[],"reason":"written","section":"history","state":"measured","step":null,"tool":null},{"count":{"src":"maps.json","unit":"count","value":null},"detail":"The system maps are not exported in this check.","parts":[],"reason":"not_built","section":"maps","state":"not_measured","step":"NS46.T6","tool":"audit"},{"count":{"src":"paths.json#paths","unit":"count","value":1},"detail":"Measured in this check.","parts":[{"detail":"0 links with their evidence","id":"links","state":"measured"}],"reason":"written","section":"paths","state":"measured","step":null,"tool":null},{"count":{"src":"journeys.json#screens","unit":"count","value":0},"detail":"Measured; nothing was found.","parts":[],"reason":"nothing_found","section":"journeys","state":"empty","step":null,"tool":null},{"count":{"src":"hidden.json#items","unit":"count","value":4},"detail":"Measured in this check.","parts":[],"reason":"written","section":"hidden","state":"measured","step":null,"tool":null},{"count":{"src":"data_paths.json#stores","unit":"count","value":0},"detail":"Measured; nothing was found.","parts":[{"detail":"input field: no write in this project","id":"field","state":"empty"},{"detail":"form: no write in this project","id":"form","state":"empty"},{"detail":"request key: no write in this project","id":"key","state":"empty"},{"detail":"calling module: no write in this project","id":"caller","state":"empty"},{"detail":"endpoint: no write in this project","id":"endpoint","state":"empty"},{"detail":"server handler: no write in this project","id":"handler","state":"empty"},{"detail":"column: no write in this project","id":"column","state":"empty"}],"reason":"nothing_found","section":"data_paths","state":"empty","step":null,"tool":null},{"count":{"src":"infra.json","unit":"count","value":null},"detail":"Measured in this check.","parts":[{"detail":"hosting: 0 today; the target says nothing about it yet","id":"hosting","state":"empty"},{"detail":"CI/CD: 0 today; the target decides it","id":"ci","state":"empty"},{"detail":"environments: 0 today; the target decides it","id":"environments","state":"empty"},{"detail":"databases: 0 today; the target decides it","id":"databases","state":"empty"},{"detail":"queues: 0 today; the target says nothing about it yet","id":"queues","state":"empty"},{"detail":"external services: 0 today; the target says nothing about it yet","id":"services","state":"empty"},{"detail":"observability: 0 today; the target decides it","id":"observability","state":"empty"}],"reason":"written","section":"infra","state":"measured","step":null,"tool":null},{"count":{"src":"pipeline.json#stages","unit":"count","value":0},"detail":"Measured; nothing was found.","parts":[{"detail":"0 stages and 0 edges with their evidence","id":"stages","state":"measured"}],"reason":"nothing_found","section":"pipeline","state":"empty","step":null,"tool":null},{"count":{"src":"ideal.json#views[].planned.elements","unit":"count","value":null},"detail":"The ideal shown is the rules' target. It is not planned yet: re-plan it from the command centre with your assistant (Claude Code or Codex).","parts":[{"detail":"the rules' target only","id":"system","state":"partial"},{"detail":"the rules' target only","id":"change","state":"partial"},{"detail":"the rules' target only","id":"journeys","state":"partial"},{"detail":"the rules' target only","id":"paths","state":"partial"},{"detail":"the rules' target only","id":"data_paths","state":"partial"},{"detail":"the rules' target only","id":"infra","state":"partial"},{"detail":"the rules' target only","id":"pipeline","state":"partial"},{"detail":"the rules' target only","id":"plan_order","state":"partial"}],"reason":"some_parts_missing","section":"ideal","state":"partial","step":"NS46.T14","tool":"replan_ideal"},{"count":{"src":"nodes.json#nodes","unit":"count","value":6},"detail":"The AI nodes have not run on this check yet: run them from the command centre.","parts":[{"detail":"not run yet","id":"card_triage","state":"not_measured"},{"detail":"not run yet","id":"visual_reviewer","state":"not_measured"},{"detail":"not run yet","id":"ideal_planner","state":"not_measured"},{"detail":"not run yet","id":"pipeline_gap_planner","state":"not_measured"},{"detail":"not run yet","id":"plan_orderer","state":"not_measured"},{"detail":"not run yet","id":"fix_reviewer","state":"not_measured"}],"reason":"some_parts_missing","section":"nodes","state":"partial","step":"NS46.T15","tool":"run_nodes"},{"count":{"src":"system.json","unit":"count","value":null},"detail":"Measured in this check.","parts":[],"reason":"written","section":"system","state":"measured","step":null,"tool":null}]}